{
  "catalog_id": "travel-tools-catalog-v1",
  "revision": "tool-catalog-v1.5",
  "source": "course_authored_training_fixture",
  "observed_at": "2026-08-22T00:00:00+08:00",
  "valid_until": "2026-09-30T23:59:59+08:00",
  "is_simulated": true,
  "notice": "课堂工具目录和执行结果均为模拟数据，不连接真实预订、支付、账户或运维系统。",
  "tools": [
    {"name":"poi.search","version":"1.0","namespace":"poi","summary":"按城市、日期和偏好搜索景点候选","use_when":["需要找景点或按标签筛选景点"],"avoid_when":["已知 poi_id，只需单个景点详情"],"keywords":["景点","去哪","亲子","室内","无障碍","必去"],"permissions":["travel.read"],"risk_level":"low","side_effect":"none","requires_confirmation":false,"latency_class":"fast","environments":["training"],"input_schema":{"type":"object","additionalProperties":false,"properties":{"city":{"type":"string"},"date":{"type":"string","format":"date"},"tags":{"type":"array","items":{"type":"string"}},"indoor_only":{"type":"boolean"}},"required":["city","date"]}},
    {"name":"poi.get_details","version":"1.1","namespace":"poi","summary":"按 poi_id 或明确的景点名称查询开放时间、票价和预约说明","use_when":["已经获得 poi_id，需要景点详情","用户明确指定了一个景点名称，需要查询该景点详情"],"avoid_when":["用户只是想浏览或筛选多个景点候选"],"keywords":["景点详情","详细信息","开放","开不开","票价","预约","景点名称","poi_id","poi_name"],"permissions":["travel.read"],"risk_level":"low","side_effect":"none","requires_confirmation":false,"latency_class":"fast","environments":["training"],"input_schema":{"type":"object","additionalProperties":false,"properties":{"poi_id":{"type":"string","minLength":1,"description":"规范景点 ID"},"poi_name":{"type":"string","minLength":1,"description":"用户输入的景点名称或常用别名"},"city":{"type":"string","minLength":1,"description":"用于名称和别名消歧的城市"},"date":{"type":"string","format":"date"}},"required":["date"],"oneOf":[{"required":["poi_id"]},{"required":["poi_name"]}]}},
    {"name":"poi.get_accessibility","version":"1.0","namespace":"poi","summary":"查询景点无障碍和步行强度","use_when":["老人、轮椅或行动不便用户需要详情"],"avoid_when":["只需普通景点搜索"],"keywords":["无障碍","轮椅","老人","少走路","步行强度"],"permissions":["travel.read"],"risk_level":"low","side_effect":"none","requires_confirmation":false,"latency_class":"fast","environments":["training"],"input_schema":{"type":"object","additionalProperties":false,"properties":{"poi_id":{"type":"string"}},"required":["poi_id"]}},
    {"name":"poi.get_events","version":"1.0","namespace":"poi","summary":"查询指定日期的课堂模拟活动","use_when":["询问展览、演出或节庆活动"],"avoid_when":["只需景点开放信息"],"keywords":["活动","展览","演出","节庆"],"permissions":["travel.read"],"risk_level":"low","side_effect":"none","requires_confirmation":false,"latency_class":"medium","environments":["training"],"input_schema":{"type":"object","additionalProperties":false,"properties":{"city":{"type":"string"},"date":{"type":"string","format":"date"}},"required":["city","date"]}},
    {"name":"poi.get_ticket_quote","version":"1.0","namespace":"poi","summary":"查询景点门票的非约束性报价","use_when":["估算门票价格但不下单"],"avoid_when":["需要正式预订或支付"],"keywords":["门票价格","票价报价","门票预算"],"permissions":["travel.read"],"risk_level":"medium","side_effect":"none","requires_confirmation":false,"latency_class":"medium","environments":["training"],"input_schema":{"type":"object","additionalProperties":false,"properties":{"poi_id":{"type":"string"},"date":{"type":"string","format":"date"},"travelers":{"type":"integer","minimum":1}},"required":["poi_id","date","travelers"]}},
    {"name":"weather.forecast","version":"1.2","namespace":"weather","summary":"查询日期范围内的模拟天气预报，包括温度、晴雨和风况","use_when":["需要一般天气情况或判断预计风力、阵风","询问某天是否下雨或降雨"],"avoid_when":["明确询问官方天气预警"],"keywords":["天气","晴雨","下雨","降雨","会不会下雨","雨吗","温度","预报","风速","阵风","大风"],"permissions":["travel.read"],"risk_level":"low","side_effect":"none","requires_confirmation":false,"latency_class":"fast","environments":["training"],"input_schema":{"type":"object","additionalProperties":false,"properties":{"city":{"type":"string"},"start_date":{"type":"string","format":"date"},"end_date":{"type":"string","format":"date"}},"required":["city","start_date","end_date"]}},
    {"name":"weather.alerts","version":"1.0","namespace":"weather","summary":"查询指定城市和日期的模拟官方天气预警","use_when":["明确询问大风、暴雨、高温等官方预警"],"avoid_when":["只需普通天气预报或预计风力"],"keywords":["天气","预警","大风预警","暴雨预警","台风预警","高温预警"],"permissions":["travel.read"],"risk_level":"low","side_effect":"none","requires_confirmation":false,"latency_class":"fast","environments":["training"],"input_schema":{"type":"object","additionalProperties":false,"properties":{"city":{"type":"string"},"date":{"type":"string","format":"date"}},"required":["city","date"]}},
    {"name":"weather.air_quality","version":"1.0","namespace":"weather","summary":"查询课堂模拟空气质量","use_when":["明确询问空气质量"],"avoid_when":["只询问降雨或温度"],"keywords":["空气质量","AQI","雾霾"],"permissions":["travel.read"],"risk_level":"low","side_effect":"none","requires_confirmation":false,"latency_class":"medium","environments":["training"],"input_schema":{"type":"object","additionalProperties":false,"properties":{"city":{"type":"string"},"date":{"type":"string","format":"date"}},"required":["city","date"]}},
    {"name":"mobility.search_intercity","version":"1.0","namespace":"mobility","summary":"搜索城市间火车、航班和长途交通","use_when":["出发地和目的地属于不同城市"],"avoid_when":["同城路线使用 mobility.search_local_transit"],"keywords":["高铁","火车","航班","飞机","跨城","上海到厦门","上海飞厦门"],"permissions":["travel.read"],"risk_level":"low","side_effect":"none","requires_confirmation":false,"latency_class":"slow","environments":["training"],"input_schema":{"type":"object","additionalProperties":false,"properties":{"origin":{"type":"string"},"destination":{"type":"string"},"departure_date":{"type":"string","format":"date"},"mode":{"type":"string","enum":["any","train","flight","bus"]}},"required":["origin","destination","departure_date","mode"]}},
    {"name":"mobility.search_local_transit","version":"1.0","namespace":"mobility","summary":"搜索城市内两点之间的交通方案","use_when":["查询同城景点之间怎么走"],"avoid_when":["跨城出行使用 mobility.search_intercity"],"keywords":["怎么走","市内交通","公交","地铁","两点路线"],"permissions":["travel.read"],"risk_level":"low","side_effect":"none","requires_confirmation":false,"latency_class":"medium","environments":["training"],"input_schema":{"type":"object","additionalProperties":false,"properties":{"origin":{"type":"string"},"destination":{"type":"string"},"date":{"type":"string","format":"date"},"mode":{"type":"string","enum":["any","metro","bus","walk"]}},"required":["origin","destination","date","mode"]}},
    {"name":"mobility.route_matrix","version":"1.0","namespace":"mobility","summary":"计算有限 POI 集合的冻结路线耗时矩阵","use_when":["批量比较多个景点的路线耗时"],"avoid_when":["只查两点出行方案"],"keywords":["路线矩阵","批量耗时","顺路","多个景点距离"],"permissions":["travel.read"],"risk_level":"low","side_effect":"none","requires_confirmation":false,"latency_class":"medium","environments":["training"],"input_schema":{"type":"object","additionalProperties":false,"properties":{"poi_ids":{"type":"array","minItems":2,"maxItems":12,"items":{"type":"string"}}},"required":["poi_ids"]}},
    {"name":"mobility.search_ferry","version":"1.1","namespace":"mobility","summary":"查询厦门轮渡的课堂模拟班次、指定时间和旅客类型余票","use_when":["涉及鼓浪屿或明确询问轮渡、船票、余票","需要核对指定班次和老人、儿童等旅客类型库存"],"avoid_when":["普通市内公交路线"],"keywords":["轮渡","渡轮","船","船票","余票","剩余票","班次","鼓浪屿船票","码头","09:10"],"permissions":["travel.read"],"risk_level":"low","side_effect":"none","requires_confirmation":false,"latency_class":"medium","environments":["training"],"input_schema":{"type":"object","additionalProperties":false,"properties":{"origin_pier":{"type":"string"},"destination_pier":{"type":"string"},"date":{"type":"string","format":"date"},"departure_time":{"type":"string","pattern":"^(?:[01]\\d|2[0-3]):[0-5]\\d$","description":"可选；指定要核对的开航时间，例如 09:10"},"passenger_types":{"type":"array","minItems":1,"items":{"type":"object","additionalProperties":false,"properties":{"type":{"type":"string","enum":["adult","senior","child"]},"count":{"type":"integer","minimum":1}},"required":["type","count"]},"description":"可选；按旅客类型返回库存，例如 senior 和 child"}},"required":["origin_pier","destination_pier","date"]}},
    {"name":"mobility.estimate_walk","version":"1.0","namespace":"mobility","summary":"估算步行距离和时间","use_when":["判断少走路或无障碍约束"],"avoid_when":["需要完整公共交通路线"],"keywords":["步行多久","走路","步行距离","少走路"],"permissions":["travel.read"],"risk_level":"low","side_effect":"none","requires_confirmation":false,"latency_class":"fast","environments":["training"],"input_schema":{"type":"object","additionalProperties":false,"properties":{"origin":{"type":"string"},"destination":{"type":"string"}},"required":["origin","destination"]}},
    {"name":"stay.search_hotels","version":"1.0","namespace":"stay","summary":"搜索酒店模拟库存和价格，不执行预订","use_when":["入住、离店、人数和城市已知"],"avoid_when":["已知 hotel_id，只需详情或报价"],"keywords":["酒店","找酒店","住宿","入住","离店","每晚"],"permissions":["travel.read"],"risk_level":"low","side_effect":"none","requires_confirmation":false,"latency_class":"slow","environments":["training"],"input_schema":{"type":"object","additionalProperties":false,"properties":{"city":{"type":"string"},"check_in":{"type":"string","format":"date"},"check_out":{"type":"string","format":"date"},"guests":{"type":"integer","minimum":1},"max_price":{"type":"number","minimum":0},"near_poi":{"type":"string"}},"required":["city","check_in","check_out","guests"]}},
    {"name":"stay.get_room_inventory","version":"1.0","namespace":"stay","summary":"查询指定酒店和日期的模拟房型库存","use_when":["已有 hotel_id，需要确认指定日期是否有房"],"avoid_when":["还没有酒店候选"],"keywords":["房间库存","有没有房","余房","房型库存","可订房间"],"permissions":["travel.read"],"risk_level":"low","side_effect":"none","requires_confirmation":false,"latency_class":"fast","environments":["training"],"input_schema":{"type":"object","additionalProperties":false,"properties":{"hotel_id":{"type":"string"},"check_in":{"type":"string","format":"date"},"check_out":{"type":"string","format":"date"},"room_type":{"type":"string"}},"required":["hotel_id","check_in","check_out"]}},